model, cell, input, neuron, visual, unit, network, direction, motion, field
neuron, network, model, neural, input, system, cell, pattern, spike, function
model, control, learning, network, system, neural, controller, movement, dynamic, forward
function, network, neural, threshold, input, weight, bound, set, number, result
target, speaker, system, location, display, cue, classifier, learning, cues, data
network, unit, input, learning, training, string, set, neural, weight, grammar
network, chip, weight, neuron, neural, learning, input, analog, system, output
model, data, network, algorithm, parameter, set, distribution, learning, problem, tree
learning, function, action, algorithm, model, policy, problem, system, control, optimal
network, set, algorithm, training, model, predisposition, data, method, exemplar, component
component, algorithm, function, learning, data, network, information, signal, matrix, input
network, model, speech, system, training, recognition, neural, set, data, word
model, data, gaussian, algorithm, network, parameter, function, distribution, set, input
function, algorithm, set, learning, model, data, problem, vector, error, training
network, error, learning, weight, training, function, set, input, generalization, neural
network, model, disparity, digit, rotation, output, option, activation, unit, input
network, unit, input, neural, learning, output, system, training, weight, hidden
model, learning, movement, network, neuron, apg, part, neural, motor, system
network, model, unit, variables, response, gaussian, conditional, density, structure, markov
input, voltage, chip, wta, signal, analog, offset, output, circuit, neural
unit, input, vector, space, network, hidden, data, algorithm, weight, learning
learning, routing, network, reinforcement, path, load, control, node, packet, traffic
image, network, model, object, images, set, learning, system, point, neural
input, parameter, neuron, potassium, output, model, conductance, calcium, dendrite, rate
word, network, input, model, pattern, recognition, set, character, vector, training
cell, orientation, input, model, cortical, neuron, visual, response, contrast, cortex
tuning, population, width, encoding, neuron, information, fisher, neural, field, stimulus
circuit, output, system, input, current, analog, model, chip, signal, network
network, training, set, input, error, learning, data, neural, classifier, pattern
input, parameter, neuron, potassium, output, model, conductance, calcium, dendrite, rate